{
  "$schema": "http://json-schema.org/draft-07/schema#",
  "$id": "https://github.com/foundry-prompt-agent-cicd-accelerator/schemas/agent-manifest.schema.json",
  "title": "Foundry Prompt Agent Manifest",
  "description": "Deployment-neutral description of an Azure AI Foundry prompt agent. The manifest is source of truth in Git and is converted to an Agent Service payload at deploy time by ConvertTo-FoundryAgentPayload.",
  "type": "object",
  "required": ["schemaVersion", "name", "version", "model", "instructions"],
  "additionalProperties": false,
  "properties": {
    "$schema": { "type": "string" },
    "schemaVersion": { "const": "1.0.0" },
    "name": {
      "type": "string",
      "description": "Logical agent name. Stable across environments and used as the promotion key.",
      "pattern": "^[a-z][a-z0-9-]{2,62}$"
    },
    "version": {
      "type": "string",
      "description": "Semantic version of the agent definition. Bump on every functional change.",
      "pattern": "^(0|[1-9][0-9]*)\\.(0|[1-9][0-9]*)\\.(0|[1-9][0-9]*)$"
    },
    "displayName": { "type": "string", "minLength": 1, "maxLength": 256 },
    "description": { "type": "string", "minLength": 1, "maxLength": 512 },
    "owner": {
      "type": "object",
      "required": ["team", "contact"],
      "additionalProperties": false,
      "properties": {
        "team": { "type": "string", "minLength": 1 },
        "contact": { "type": "string", "minLength": 1, "description": "Distribution list or Teams channel. Do not use personal contact details." },
        "costCenter": { "type": "string" },
        "supportUrl": { "type": "string", "format": "uri" }
      }
    },
    "classification": {
      "type": "object",
      "required": ["dataSensitivity", "businessCriticality"],
      "additionalProperties": false,
      "properties": {
        "dataSensitivity": { "enum": ["public", "internal", "confidential", "highly-confidential"] },
        "businessCriticality": { "enum": ["low", "medium", "high", "mission-critical"] },
        "processesPersonalData": { "type": "boolean", "default": false },
        "humanInTheLoop": { "type": "boolean", "default": false },
        "responsibleAiReviewId": { "type": "string", "description": "Identifier of the completed Responsible AI review record." }
      }
    },
    "model": {
      "type": "object",
      "required": ["deploymentName"],
      "additionalProperties": false,
      "properties": {
        "deploymentName": {
          "type": "string",
          "minLength": 1,
          "description": "Name of the model deployment in the target Foundry account. Environment overlays normally override this."
        },
        "modelFamily": { "type": "string", "description": "Informational only, for inventory and governance reporting." },
        "parameters": {
          "type": "object",
          "additionalProperties": false,
          "properties": {
            "temperature": { "type": "number", "minimum": 0, "maximum": 2 },
            "topP": { "type": "number", "minimum": 0, "maximum": 1 }
          }
        },
        "responseFormat": {
          "type": "object",
          "required": ["type"],
          "additionalProperties": false,
          "properties": {
            "type": { "enum": ["auto", "text", "json_object", "json_schema"] },
            "jsonSchemaFile": { "type": "string", "description": "Repository-relative path to the JSON schema used when type is json_schema." }
          }
        }
      }
    },
    "instructions": {
      "type": "object",
      "required": ["file"],
      "additionalProperties": false,
      "properties": {
        "file": { "type": "string", "minLength": 1, "description": "Path, relative to the manifest, of the Markdown instruction file." },
        "maxLength": { "type": "integer", "minimum": 1, "default": 256000 }
      }
    },
    "tools": {
      "type": "array",
      "description": "Tool references. Each entry points at a tool definition file validated by tool-definition.schema.json.",
      "items": {
        "type": "object",
        "required": ["ref"],
        "additionalProperties": false,
        "properties": {
          "ref": { "type": "string", "minLength": 1, "description": "Path, relative to the manifest, of the tool definition file." },
          "enabled": { "type": "boolean", "default": true }
        }
      }
    },
    "evaluations": {
      "type": "object",
      "additionalProperties": false,
      "properties": {
        "suiteFile": { "type": "string", "description": "Path, relative to the manifest, of the evaluation suite." },
        "required": { "type": "boolean", "default": true, "description": "When true, promotion gates fail if the evaluation suite is missing or below threshold." }
      }
    },
    "metadata": {
      "type": "object",
      "description": "Key/value pairs propagated to Agent Service metadata. Values must be strings (Agent Service constraint).",
      "maxProperties": 12,
      "additionalProperties": { "type": "string", "maxLength": 512 }
    }
  }
}
